{
  "schema_version": 1,
  "grant_id": "G-0192f3a1-284-02",
  "project": "example-web",
  "task": "T-284",
  "subtask": "T-284-2",
  "execution": "0192f3a1-7c4e-7a10-9b2d-4f5e6a7b8c9d",
  "worker": "codex-284-02",
  "role": "DEVELOPER",
  "provider_credential": { "provider": "codex", "identity": "default" },
  "issued_at": "2026-09-30T08:00:00Z",
  "expires_at": "2026-09-30T10:00:00Z",
  "lease_epoch": 3,
  "capabilities": {
    "workspace": "WRITE",
    "git": "LOCAL_COMMIT",
    "network": { "egress": "STANDARD", "test_services": true },
    "secrets": ["example-web/test/TEST_DATABASE_URL"],
    "environments": ["LOCAL", "TEST"],
    "docker": "NONE",
    "production": "NONE",
    "tests": "EXECUTE",
    "artifacts": "WRITE"
  },
  "resources": { "profile": "NORMAL", "timeout_minutes": 120 }
}
